date,text,source
2026-02-01,"match thread manchester united vs fulham fc live score premier league 2526 feb 1, 2026",r/ManchesterUnited
2026-02-01,ruben amorim,r/ManchesterUnited
2026-02-01,prime cantona,r/ManchesterUnited
2026-02-01,distance matter beckhams life,r/ManchesterUnited
2026-02-01,protest owners!!!,r/ManchesterUnited
2026-02-01,68 years ago today busby babes played last match english soil. beating arsenal 54 thriller highbury,r/ManchesterUnited
2026-02-01,starting 11,r/ManchesterUnited
2026-02-01,bad idea bring rashford back man united,r/ManchesterUnited
2026-02-01,"start maz dalot, great afcon",r/ManchesterUnited
2026-01-31,need say publicly,r/ManchesterUnited
2026-02-01,love united hate glazers!,r/ManchesterUnited
2026-02-01,"competition predict todays scoreline scorers, win user flair!",r/ManchesterUnited
2026-02-01,ill leave,r/ManchesterUnited
2026-02-01,real test later. better done last match?,r/ManchesterUnited
2026-02-01,"l. martinez short height, tall attitude",r/ManchesterUnited
2026-01-31,found cursed image internet,r/ManchesterUnited
2026-02-01,"gonna die, hes gonna die",r/ManchesterUnited
2026-01-31,patrick dorgu wins january player month!,r/ManchesterUnited
2026-01-31,ultimate one got away transfer would transformed utd?,r/ManchesterUnited
2026-02-01,line fulham,r/ManchesterUnited
2026-02-01,tv coverage discussion,r/ManchesterUnited
2026-02-01,"pint mod users going todays protests want pint me, im buying!",r/ManchesterUnited
2026-01-31,sending love way florida!,r/ManchesterUnited
2026-01-31,"vs fulham going find true nature carricks man united. first time since carrick returned team book favorite win, expected fans win, pressure win regain 4th. cant wait!",r/ManchesterUnited
2026-01-31,one talking good lisandro martinez,r/ManchesterUnited
2026-01-31,2011 wayne rooney,r/ManchesterUnited
2026-01-31,sporting fan def right!,r/ManchesterUnited
2026-01-31,cunha first manutd player score opponent cuns whose first three letters first three letters first name,r/ManchesterUnited
2026-01-31,anyone see fan angle cunhas goal showed raya trying get ball back restart game quick maguire smashed away crowd?,r/ManchesterUnited
2026-02-01,requiem win,r/ManchesterUnited
2026-01-31,next time dont bring family come help corner,r/ManchesterUnited
2026-01-31,"clubs played football, united prime played destiny.",r/ManchesterUnited
2026-02-01,whats match day routine?,r/ManchesterUnited
2026-01-31,official patrick dorgu manchester uniteds january player month award.,r/ManchesterUnited
2026-01-31,man united 2003 lets buy skinny kid football history activated.,r/ManchesterUnited
2026-01-31,prime time,r/ManchesterUnited
2026-01-31,busby babes,r/ManchesterUnited
2026-02-01,"anymore predictions get ball rolling? going 30 favour goals cunha, bruno, mbuemo.",r/ManchesterUnited
2026-02-01,confirmed lineup vs fulham,r/ManchesterUnited
2026-02-01,anyone link watch game ??,r/ManchesterUnited
2026-02-01,lower leagues,r/ManchesterUnited
2026-01-31,new players...distraction new manager,r/ManchesterUnited
2026-01-31,always playing sunday?,r/ManchesterUnited
2026-01-31,important game tomorrow.,r/ManchesterUnited
2026-01-31,"beat tottenham play next week, first time since 201011 beaten fellow big 6 rivals season. incredible!!",r/ManchesterUnited
2026-02-01,might try bar somewhere watch game? good spot?,r/ManchesterUnited
2026-01-31,alex ferguson era,r/ManchesterUnited
2026-01-30,63 years agodenis law asleep train home wembley scoring fa cup final win leicester 1963,r/ManchesterUnited
2026-01-31,day 5 peter schmeichel wins,r/ManchesterUnited
2026-01-31,didnt get new players transfer window chances getting top 4 season.,r/ManchesterUnited
2026-02-01,predicted lineups!,r/ManchesterUnited
2026-01-30,massive upgrade . talked enough means really good senne lammens,r/ManchesterUnited
2026-01-31,cant believe beat season,r/ManchesterUnited
2026-01-30,sesko needs start fulham,r/ManchesterUnited
2026-02-01,think viteks performance bristols recent match? bristol city 05 derby,r/ManchesterUnited
2026-01-31,applaud far bruno come tactically speaking,r/ManchesterUnited
2026-02-01,bryan mbeumo vs benjamin sesko,r/ManchesterUnited
2026-01-30,lazio fans left stadium empty protest owner.,r/ManchesterUnited
2026-01-31,match predictions man utd vs fulham,r/ManchesterUnited
2026-02-01,beat fulham?,r/ManchesterUnited
2026-01-30,"6 years ago, today january 30 , magician captain arrived. 200 goals contributions counting.. best signing post saf .. captain brunoooooooo",r/ManchesterUnited
2026-01-30,"united, dont dare kill pure bliss ive gotten used",r/ManchesterUnited
2026-01-30,become supporter?,r/ManchesterUnited
2026-01-31,devil disguise?,r/ManchesterUnited
2026-01-30,happy birthday berba,r/ManchesterUnited
2026-01-30,best signing post saf,r/ManchesterUnited
2026-01-30,chinese president xi jinping tells uk prime minister starmer fan manchester united.,r/ManchesterUnited
2026-01-30,potential swap deal casado rashford,r/ManchesterUnited
2026-01-30,rumours emerging could bidding war dalot come deadline day.,r/ManchesterUnited
2026-01-30,wazza mentality monster,r/ManchesterUnited
2026-02-01,almost certain lose draw fulham,r/ManchesterUnited
2026-01-31,hell happened televised football? close ups every 5 seconds,r/ManchesterUnited
2026-01-30,anyone ready fulham match?,r/ManchesterUnited
2026-01-30,wouldnt mind selection since patrick,r/ManchesterUnited
2026-01-30,cunhabrunocunha . talked enough,r/ManchesterUnited
2026-01-31,help signatures,r/ManchesterUnited
2026-01-30,"bad squad considering one game week . starting 11 vs fulham , cunha sesko back team",r/ManchesterUnited
2026-01-29,"still cannot believe injury prone luke shaw started 23 man utds premier league games season. minutes man utd player season 2,004. credit due.....",r/ManchesterUnited
2026-01-31,michael carrick reveals best thing kobbie mainoo,r/ManchesterUnited
2026-01-30,january 17ths manchester derby earned 2m viewers peacock usa network,r/ManchesterUnited
2026-01-31,targets summer window,r/ManchesterUnited
2026-01-30,important player post fergie?,r/ManchesterUnited
2026-01-30,upon time...,r/ManchesterUnited
2026-01-30,goretzka free cover cm next 23 years?,r/ManchesterUnited
2026-01-30,januarys goal month decided! ggmu!,r/ManchesterUnited
2026-01-30,thanks facilities... take stockport tomorrow,r/ManchesterUnited
2026-01-29,dalot demand,r/ManchesterUnited
2026-01-30,oc united vs fulham preview beat midblock,r/ManchesterUnited
2026-01-29,dimitar berbatov born 45 years ago today,r/ManchesterUnited
2026-01-29,theatre dreams dark,r/ManchesterUnited
2026-01-30,screamers only! top 10 goals v fulham old trafford,r/ManchesterUnited
2026-01-30,stansportfc lisandro martinez quotes michael carrick,r/ManchesterUnited
2026-01-29,roberto de zerbi linked united job reportedly handed resignation marseille head coach,r/ManchesterUnited
2026-01-31,carricks results city arsenal honestly wouldnt mind,r/ManchesterUnited
2026-01-29,six years bruno fernandes manchester united,r/ManchesterUnited
2026-01-29,best player clubs history?,r/ManchesterUnited
2026-01-30,never stop loving united,r/ManchesterUnited
2026-01-29,van persieee..,r/ManchesterUnited
2026-01-30,best place buy match tickets?,r/ManchesterUnited
2026-01-29,pr shenanigans full swing! plonkers,r/ManchesterUnited
2026-02-01,match thread manchester united vs fulham,r/RedDevils
2026-02-01,"ft manchester united 31 liverpool. goals lisa naalsund x2, fridolina rolfo. united record 4 wins spin.",r/RedDevils
2026-02-01,"manchester united team vs fulham english premier league 01 february 2026 starting xi lammens, dalot, maguire, martinez, shaw, casemiro, mainoo, amad, fernandes, cunha, mbeumo.",r/RedDevils
2026-02-01,"former reds wolves agree deal principle sign angel gomes, go! loan move olympique marseille 1m fee plus buy option clause around 7m fee",r/RedDevils
2026-02-01,man united 1 0 liverpool lisa naalsund 52,r/RedDevils
2026-02-01,"mount absence explained speaking sky sports, head coach carrick provided positive bulletin. bit knock training, said carrick. nothing serious. disappointed us today hell back soon.",r/RedDevils
2026-02-01,man united 2 1 liverpool lisa naalsund 60,r/RedDevils
2026-02-01,man united 3 1 liverpool fridolina rolf 87,r/RedDevils
2026-02-01,"man united xi vs liverpool wsl gameweek 14 tullisjoyce sandberg, le tissier c, janssen, riviere naalsund, zigiotti, hinata park, terland, malard",r/RedDevils
2026-02-01,"fulham team vs manchester united starting xi leno, castagne, andersen, cuenca, robinson, berge, iwobi, chukwueze, wilson, smith rowe, jimnez.",r/RedDevils
2026-01-31,bruno fernandes ig j6urney far,r/RedDevils
2026-01-31,"press con. pt2 carrick united playing worse lesser sides whats important us understand going take taken get results. respect, ive said marco fulham team, think big, bigger test weve had.",r/RedDevils
2026-02-01,a. diallo chance fulham 5,r/RedDevils
2026-01-31,longer term injury. loan mufc needs decision together. norwich city boss philippe clement confirms ncfc loanee harry amass looking period sidelines,r/RedDevils
2026-02-01,s. lammens great save fulham 13,r/RedDevils
2026-02-01,bryan mbeumo chance fulham 10,r/RedDevils
2026-01-31,"january player month popular winner... congratulations, deserve this!",r/RedDevils
2026-01-31,elche 1 3 barcelona marcus rashford 72,r/RedDevils
2026-01-31,"jason burt inside marcus rashfords new life barcelona telegraph sport reveal michael carrick retained uniteds head coach beyond season, would like former teammate back",r/RedDevils
2026-01-31,p h l l n mufc women january potm,r/RedDevils
2026-01-31,rhys bennett completed permanent transfer fleetwood town,r/RedDevils
2026-01-31,michael carrick prefulham press conference part two,r/RedDevils
2026-01-31,pre match thread premier league game 24 manchester united vs fulham,r/RedDevils
2026-01-31,going like game. michael carrick prefulham interview,r/RedDevils
2026-01-31,daily discussion,r/RedDevils
2026-01-30,one winner. votes mean patrick claimed january goal month award,r/RedDevils
2026-01-31,"premier league watch 31st january, 2026",r/RedDevils
2026-01-30,breaking dorgus goal individuals pov vr,r/RedDevils
2026-01-30,carl anka cunha? mount? amad? manchester united could replace patrick chinazaekpere dorgu,r/RedDevils
2026-01-31,michael carrick reveals best thing kobbie mainoo,r/RedDevils
2026-01-30,joe hugill joins kilmarnock permanent deal,r/RedDevils
2026-01-30,"lisandro martinez need people understand quality, think carrick that. hes getting best everybody. me, touch heart, give everything hes touched already see pitch give everything.",r/RedDevils
2026-01-30,thanks facilities... take stockport tomorrow,r/RedDevils
2026-01-30,zirkzee instagram,r/RedDevils
2026-01-30,toby collyer joins hull city loan remainder season,r/RedDevils
2026-01-30,professional footballers association delivery portuguese magnifico red devils skipper bruno fernandes united pfa players player year top six award,r/RedDevils
2026-01-30,"press conference carrick dorgus injury pat unfortunately going period time. still working that. itll weeks. many weeks, well wait see. zirkzee de ligt josh back training week. de ligt isnt training us yet",r/RedDevils
2026-01-30,taking anything granted order michael carrick prefulham press conference,r/RedDevils
2026-01-30,locked carrington inside training,r/RedDevils
2026-01-29,6 years ago today manchester united signed bruno fernandes,r/RedDevils
2026-01-30,daily discussion,r/RedDevils
2026-01-30,"202526 premier league, eredivisie, bundesliga, ligue 1, serie a, belgian pro league, championship, la liga primeira liga tables could change gameweek",r/RedDevils
2026-01-30,matchday programme vs fulham,r/RedDevils
2026-01-29,starmer gifts xi football man utdarsenal match,r/RedDevils
2026-01-30,free talk friday,r/RedDevils
2026-01-29,tyler fredricson set stay mufc month seeing loan move scuppered calf issue. several championship belgian pro league clubs registered interest united defender faces around four weeks simon peach,r/RedDevils
2026-01-29,simon stone manchester united steve holland could key revival michael carrick,r/RedDevils
2026-01-29,senne lammens making manchester united better,r/RedDevils
2026-01-29,man utds january goal month contenders!,r/RedDevils
2026-01-29,talk devils fulham truer test carricks man united?,r/RedDevils
2026-01-29,daily discussion,r/RedDevils
2026-01-29,england course fifth champions league spot,r/RedDevils
2026-01-28,amad laughs yoros new outfit,r/RedDevils
2026-01-28,patrick dorgu wins premier leagues player matchweek,r/RedDevils
2026-01-28,loan watch napoli 2 1 chelsea rasmus hojlund 43,r/RedDevils
2026-01-28,instagramthe vibes good carrington morning,r/RedDevils
2026-01-28,barcelona 4 1 fc copenhagen marcus rashford freekick 84,r/RedDevils
2026-01-28,man utd aston villa effective breaking low blocks whilst arsenal liverpool struggle,r/RedDevils
2026-01-28,squawka stats epl 2526,r/RedDevils
2026-01-28,rich fay understand united make move sign rennes forward kader meit deadline day. interest player described exaggerated,r/RedDevils
2026-01-28,andy mitten manchester united harry maguire conundrum,r/RedDevils
2026-01-28,graph premier league weighted nonpen xg 70 nonpen goals 30 gw23. last 10 played close game state 1 goal.,r/RedDevils
2026-01-28,every bruno fernandes assist season far!,r/RedDevils
2026-01-28,"man utd confirm academy coaching positions manchester united appointed adam lawrence under21s lead coach, end season.",r/RedDevils
2026-01-27,maguire gabriel full time whistle,r/RedDevils
2026-01-28,daily discussion,r/RedDevils
2026-01-27,premierleague ig lets take closer look goal,r/RedDevils
2026-01-27,"scott mctominay ive got much love respect carrick. two results vs man city arsenal amazing, especially watch. im very, proud players long may continue.",r/RedDevils
2026-01-28,frontrunners man united job?,r/RedDevils
2026-01-27,daisy maguire took us man utd vs man city,r/RedDevils
2026-01-27,diogo dalot instagram,r/RedDevils
2026-01-27,wheeler andre onanas representatives talks potential return inter milan man utd summer,r/RedDevils
2026-01-27,spidercam footage goals cityarsenal,r/RedDevils
2026-01-28,lastgasp winner! u18 highlights burnley 12 man utd,r/RedDevils
2026-01-27,laurie whitwell manchester uniteds patrick dorgu set miss around 10 weeks hamstring injury,r/RedDevils
2026-01-27,ed aarons understand manchester united considering stepping interest kader meit rennes held talks players entourage. 18yearold striker expected cost around 30m also interest al hilal,r/RedDevils
2026-01-27,michael carrick manager maguire mbeumo alan shearers pl team week,r/RedDevils
2026-01-27,"manchester united pleased announce collette roche appointed brandnew role club chief executive officer, new stadium development, formalising role leading clubs participation old trafford regeneration planning date.",r/RedDevils
2026-01-27,breakdown dorgu cunha goal individual feint moves,r/RedDevils
2026-01-27,patrick dorgu nominated pl player matchweek 23,r/RedDevils
2026-01-27,referee review harry maguires handball arsenal vs man. united,r/RedDevils
2026-01-27,harry maguire ayden heaven exclusive inside carrington ep 12,r/RedDevils
2026-01-26,mainoo listens cunhas advice,r/RedDevils
2026-01-27,david squires on... manchester united giving arsenal title wobbles,r/RedDevils
2026-01-27,daily discussion,r/RedDevils
2026-01-26,heart sleeve. united chest. red covered ground kobbie last two games,r/RedDevils
2026-01-26,optajoe 2 arsenal lost two games mikel arteta theyve scored least twice,r/RedDevils
2026-01-27,shock! manchester united stun arsenal emirates! arsenal 23 manchester united pl raw youtube,r/RedDevils
2026-01-27,"mark critchley, athletic transfer dealsheet latest man utd, arsenal, liverpool, real madrid",r/RedDevils
2026-01-26,premier league table matchday 23,r/RedDevils
2026-01-26,matheus cunhas goal vs arsenal 1st scored substitute united premier league season,r/RedDevils
2026-01-26,"laurie whitwell rewatching dorgus goal. comes end 5min spell united dominated possession, aside arsenal clearances, every player touching ball. move nine passes, six players, martinez punching lines spark. spectacular, built competency.",r/RedDevils
2026-01-26,harry maguire ig come punch another one clear us,r/RedDevils
2026-01-26,mike keegan good news manchester united food health inspectors hand fivestar rating,r/RedDevils
2026-01-26,united best performing side matches involving top 6,r/RedDevils
2026-01-26,"bruno fernandes registered 200th goal contribution manchester united yesterday 103 goals, 97 assists. among midfielders 2nd quickest 10th amongst players top 5 leagues, single club, century transfermarkt",r/RedDevils
2026-01-26,james ducker data showing man utds change recruitment strategy working,r/RedDevils
2026-01-26,shea laceys freekick goal united u21s 11 draw vs brighton pl2 carrington today,r/RedDevils
2026-01-26,"united vs. arse peter drury, intro goals closing",r/RedDevils
2026-01-26,luke shaw ig successful sunday london sound,r/RedDevils
